{
  "schemaVersion": 1,
  "suite": "peritext",
  "workload": "offline-rich",
  "system": "sal-peritext-shared",
  "mode": "both",
  "preset": "bulk",
  "config": {
    "initial": 500,
    "rounds": 6,
    "burst": 300,
    "seed": 1729,
    "pairDrop": true,
    "scenario": "offline-rich",
    "representation": "shared"
  },
  "environment": {
    "node": "v26.3.1",
    "platform": "darwin arm64",
    "exposeGc": true,
    "date": "2026-08-15T09:13:16.575Z"
  },
  "gates": {
    "converged": true,
    "gcRenderPreserved": true,
    "snapshotOk": true,
    "stateCompactionFiredOrExpectedNoop": true,
    "delayedPruneRefused": true,
    "emptyMetadataFloor": true,
    "multiEpochCompaction": true
  },
  "metrics": {
    "operations": 2501,
    "elapsedMs": 4565.95525,
    "syncMs": 53.913917,
    "syncBytes": 697693,
    "historyGcMs": 0,
    "stateGcMs": 43.002792,
    "intermediateEpochs": 0,
    "intermediatePruned": 0,
    "commitsBeforeFinalGc": 2502,
    "commitsAfter": 1,
    "commitsWhileAwaitingAck": null,
    "epochPruned": 2502,
    "epochPruneReason": null,
    "durableStateBytes": 50019,
    "visibleChars": 957,
    "shadowRecords": 1121,
    "deletedIds": 164,
    "markRecords": 707,
    "coordinateSymbols": 1266,
    "renderDigest": "bd23b7ab3eb0f2046e950a00eb56c37398effc1ad44f4ca732259233ff090450"
  }
}