{
  "schemaVersion": 1,
  "suite": "peritext",
  "workload": "format-trace",
  "system": "sal-peritext-shared",
  "mode": "history",
  "preset": "bulk",
  "config": {
    "initial": 500,
    "rounds": 6,
    "burst": 300,
    "seed": 1729,
    "pairDrop": true,
    "scenario": "format-trace",
    "representation": "shared"
  },
  "environment": {
    "node": "v26.3.1",
    "platform": "darwin arm64",
    "exposeGc": true,
    "date": "2026-08-15T08:58:47.454Z"
  },
  "gates": {
    "converged": true,
    "gcRenderPreserved": true,
    "snapshotOk": true,
    "stateCompactionFiredOrExpectedNoop": true,
    "delayedPruneRefused": true,
    "emptyMetadataFloor": true,
    "multiEpochCompaction": true
  },
  "metrics": {
    "operations": 26752,
    "elapsedMs": 36373.446583,
    "syncMs": 184.695042,
    "syncBytes": 5615642,
    "historyGcMs": 37.991875,
    "stateGcMs": 0,
    "intermediateEpochs": 0,
    "intermediatePruned": 0,
    "commitsBeforeFinalGc": 26753,
    "commitsAfter": 2,
    "commitsWhileAwaitingAck": null,
    "epochPruned": 0,
    "epochPruneReason": null,
    "durableStateBytes": 91121,
    "visibleChars": 21862,
    "shadowRecords": 24220,
    "deletedIds": 2359,
    "markRecords": 173,
    "coordinateSymbols": 24220,
    "renderDigest": "0ceed9b076f7780a3a904d0ee1754ad9df7640baaf8ed9984ecda8fcb45d56b7"
  }
}