{
  "schemaVersion": 1,
  "suite": "peritext",
  "workload": "marked-delete-churn",
  "system": "sal-peritext",
  "mode": "both-delayed",
  "preset": "freq",
  "config": {
    "initial": 200,
    "rounds": 30,
    "burst": 20,
    "seed": 1729,
    "pairDrop": true,
    "scenario": "marked-delete-churn",
    "representation": "absolute"
  },
  "environment": {
    "node": "v26.3.1",
    "platform": "darwin arm64",
    "exposeGc": true,
    "date": "2026-08-15T08:42:38.594Z"
  },
  "gates": {
    "converged": true,
    "gcRenderPreserved": true,
    "snapshotOk": true,
    "stateCompactionFiredOrExpectedNoop": true,
    "delayedPruneRefused": true,
    "emptyMetadataFloor": true,
    "multiEpochCompaction": true
  },
  "metrics": {
    "operations": 601,
    "elapsedMs": 110.57662499999999,
    "syncMs": 11.132457,
    "syncBytes": 172493,
    "historyGcMs": 0,
    "stateGcMs": 5.691792,
    "intermediateEpochs": 0,
    "intermediatePruned": 0,
    "commitsBeforeFinalGc": 602,
    "commitsAfter": 1,
    "commitsWhileAwaitingAck": 603,
    "epochPruned": 602,
    "epochPruneReason": null,
    "durableStateBytes": 13220,
    "visibleChars": 40,
    "shadowRecords": 167,
    "deletedIds": 127,
    "markRecords": 240,
    "coordinateSymbols": 17307,
    "renderDigest": "84b998b6b69f51d0bded6d49888ff66f0219f8321143ba10ebc7975bd970554d"
  }
}