{
  "schemaVersion": 1,
  "suite": "peritext",
  "workload": "empty-rich",
  "system": "sal-peritext",
  "mode": "full-state",
  "preset": "freq",
  "config": {
    "initial": 200,
    "rounds": 30,
    "burst": 20,
    "seed": 1729,
    "pairDrop": true,
    "scenario": "empty-rich",
    "representation": "absolute"
  },
  "environment": {
    "node": "v26.3.1",
    "platform": "darwin arm64",
    "exposeGc": true,
    "date": "2026-08-15T08:42:44.376Z"
  },
  "gates": {
    "converged": true,
    "gcRenderPreserved": true,
    "snapshotOk": true,
    "stateCompactionFiredOrExpectedNoop": true,
    "delayedPruneRefused": true,
    "emptyMetadataFloor": true,
    "multiEpochCompaction": true
  },
  "metrics": {
    "operations": 602,
    "elapsedMs": 125.141042,
    "syncMs": 7.033042999999999,
    "syncBytes": 137471,
    "historyGcMs": 0,
    "stateGcMs": 2.610542,
    "intermediateEpochs": 0,
    "intermediatePruned": 0,
    "commitsBeforeFinalGc": 603,
    "commitsAfter": 604,
    "commitsWhileAwaitingAck": null,
    "epochPruned": 0,
    "epochPruneReason": null,
    "durableStateBytes": 9,
    "visibleChars": 0,
    "shadowRecords": 0,
    "deletedIds": 0,
    "markRecords": 0,
    "coordinateSymbols": 0,
    "renderDigest": "4f53cda18c2baa0c0354bb5f9a3ecbe5ed12ab4d8e11ba873c2f11161202b945"
  }
}