{
  "schemaVersion": 1,
  "suite": "peritext",
  "workload": "offline-rich",
  "system": "peritext-rga",
  "mode": "text-state",
  "preset": "freq",
  "config": {
    "initial": 200,
    "rounds": 30,
    "burst": 20,
    "seed": 1729,
    "pairDrop": false,
    "scenario": "offline-rich",
    "representation": "rga",
    "matrixVersion": 3
  },
  "environment": {
    "node": "v26.3.1",
    "platform": "darwin arm64",
    "exposeGc": true,
    "date": "2026-08-20T10:56:52.655Z"
  },
  "gates": {
    "converged": true,
    "gcRenderPreserved": true,
    "snapshotOk": true,
    "stateCompactionFiredOrExpectedNoop": true,
    "delayedPruneRefused": true,
    "emptyMetadataFloor": true,
    "multiEpochCompaction": true
  },
  "metrics": {
    "operations": 601,
    "elapsedMs": 125.42974999999998,
    "syncMs": 15.701666,
    "syncBytes": 155613,
    "historyGcMs": 0,
    "stateGcMs": 1.870292,
    "intermediateEpochs": 0,
    "intermediatePruned": 0,
    "commitsBeforeFinalGc": 602,
    "commitsAfter": 603,
    "commitsWhileAwaitingAck": null,
    "epochPruned": 0,
    "epochPruneReason": null,
    "durableStateBytes": 21090,
    "visibleChars": 276,
    "shadowRecords": 345,
    "identityRecords": 345,
    "deletedIds": 69,
    "markRecords": 138,
    "coordinateSymbols": 552,
    "renderDigest": "c30459f359d0b9a98f70be15a9ecfb049b86aa76bb99e2b6a6801ffaea845b37"
  }
}