{
  "schemaVersion": 1,
  "suite": "peritext",
  "workload": "marked-delete-churn",
  "system": "sal-peritext-shared",
  "mode": "text-state",
  "preset": "bulk",
  "config": {
    "initial": 500,
    "rounds": 6,
    "burst": 300,
    "seed": 1729,
    "pairDrop": false,
    "scenario": "marked-delete-churn",
    "representation": "shared"
  },
  "environment": {
    "node": "v26.3.1",
    "platform": "darwin arm64",
    "exposeGc": true,
    "date": "2026-08-15T09:10:26.060Z"
  },
  "gates": {
    "converged": true,
    "gcRenderPreserved": true,
    "snapshotOk": true,
    "stateCompactionFiredOrExpectedNoop": true,
    "delayedPruneRefused": true,
    "emptyMetadataFloor": true,
    "multiEpochCompaction": true
  },
  "metrics": {
    "operations": 2101,
    "elapsedMs": 1311.7255,
    "syncMs": 36.860333000000004,
    "syncBytes": 687875,
    "historyGcMs": 0,
    "stateGcMs": 23.552,
    "intermediateEpochs": 0,
    "intermediatePruned": 0,
    "commitsBeforeFinalGc": 2102,
    "commitsAfter": 2103,
    "commitsWhileAwaitingAck": null,
    "epochPruned": 0,
    "epochPruneReason": null,
    "durableStateBytes": 67502,
    "visibleChars": 100,
    "shadowRecords": 488,
    "deletedIds": 388,
    "markRecords": 1200,
    "coordinateSymbols": 500,
    "renderDigest": "d34d6f5f4f6cdd4041883b5786aeec0e4a8f1b01e19506b407d7fb3439cead75"
  }
}