{
  "schemaVersion": 1,
  "suite": "peritext",
  "workload": "concurrent-rich",
  "system": "sal-peritext-shared",
  "mode": "full-state",
  "preset": "freq",
  "config": {
    "initial": 200,
    "rounds": 30,
    "burst": 20,
    "seed": 1729,
    "pairDrop": true,
    "scenario": "concurrent-rich",
    "representation": "shared"
  },
  "environment": {
    "node": "v26.3.1",
    "platform": "darwin arm64",
    "exposeGc": true,
    "date": "2026-08-15T08:42:15.627Z"
  },
  "gates": {
    "converged": true,
    "gcRenderPreserved": true,
    "snapshotOk": true,
    "stateCompactionFiredOrExpectedNoop": true,
    "delayedPruneRefused": true,
    "emptyMetadataFloor": true,
    "multiEpochCompaction": true
  },
  "metrics": {
    "operations": 1401,
    "elapsedMs": 833.402917,
    "syncMs": 79.991414,
    "syncBytes": 402827,
    "historyGcMs": 0,
    "stateGcMs": 7.614292,
    "intermediateEpochs": 0,
    "intermediatePruned": 0,
    "commitsBeforeFinalGc": 1432,
    "commitsAfter": 1433,
    "commitsWhileAwaitingAck": null,
    "epochPruned": 0,
    "epochPruneReason": null,
    "durableStateBytes": 31310,
    "visibleChars": 311,
    "shadowRecords": 469,
    "deletedIds": 158,
    "markRecords": 496,
    "coordinateSymbols": 512,
    "renderDigest": "682dc18acbe938ee5a2c27f4911af0e6bd0e7bba097a7142bc66a166dfc1120a"
  }
}