{
  "schemaVersion": 1,
  "suite": "peritext",
  "workload": "multi-epoch-rich",
  "system": "sal-peritext-shared",
  "mode": "history",
  "preset": "freq",
  "config": {
    "initial": 200,
    "rounds": 30,
    "burst": 20,
    "seed": 1729,
    "pairDrop": true,
    "scenario": "multi-epoch-rich",
    "representation": "shared"
  },
  "environment": {
    "node": "v26.3.1",
    "platform": "darwin arm64",
    "exposeGc": true,
    "date": "2026-08-15T08:42:46.876Z"
  },
  "gates": {
    "converged": true,
    "gcRenderPreserved": true,
    "snapshotOk": true,
    "stateCompactionFiredOrExpectedNoop": true,
    "delayedPruneRefused": true,
    "emptyMetadataFloor": true,
    "multiEpochCompaction": true
  },
  "metrics": {
    "operations": 321,
    "elapsedMs": 37.971875000000004,
    "syncMs": 7.073541999999999,
    "syncBytes": 68165,
    "historyGcMs": 0.56725,
    "stateGcMs": 0,
    "intermediateEpochs": 0,
    "intermediatePruned": 0,
    "commitsBeforeFinalGc": 325,
    "commitsAfter": 3,
    "commitsWhileAwaitingAck": null,
    "epochPruned": 0,
    "epochPruneReason": null,
    "durableStateBytes": 3073,
    "visibleChars": 212,
    "shadowRecords": 246,
    "deletedIds": 35,
    "markRecords": 40,
    "coordinateSymbols": 246,
    "renderDigest": "30eb503a7543367aebbb7f8a6f0de0818880d5f30940be7d168f51ec4a5fa77a"
  }
}