{
  "schemaVersion": 1,
  "suite": "peritext",
  "workload": "format-trace",
  "system": "peritext-embed-rga",
  "mode": "text-state",
  "preset": "bulk",
  "config": {
    "initial": 500,
    "rounds": 6,
    "burst": 300,
    "seed": 1729,
    "pairDrop": false,
    "scenario": "format-trace",
    "representation": "embed-rga",
    "matrixVersion": 3
  },
  "environment": {
    "node": "v26.3.1",
    "platform": "darwin arm64",
    "exposeGc": true,
    "date": "2026-08-20T11:06:25.616Z"
  },
  "gates": {
    "converged": true,
    "gcRenderPreserved": true,
    "snapshotOk": true,
    "stateCompactionFiredOrExpectedNoop": true,
    "delayedPruneRefused": true,
    "emptyMetadataFloor": true,
    "multiEpochCompaction": true
  },
  "metrics": {
    "operations": 26752,
    "elapsedMs": 35729.811666999994,
    "syncMs": 349.936541,
    "syncBytes": 5957797,
    "historyGcMs": 0,
    "stateGcMs": 112.567166,
    "intermediateEpochs": 0,
    "intermediatePruned": 0,
    "commitsBeforeFinalGc": 26753,
    "commitsAfter": 26754,
    "commitsWhileAwaitingAck": null,
    "epochPruned": 0,
    "epochPruneReason": null,
    "durableStateBytes": 72182,
    "visibleChars": 21862,
    "shadowRecords": 21869,
    "identityRecords": 21869,
    "deletedIds": 7,
    "markRecords": 173,
    "coordinateSymbols": 22313,
    "renderDigest": "0ceed9b076f7780a3a904d0ee1754ad9df7640baaf8ed9984ecda8fcb45d56b7"
  }
}