{
  "schemaVersion": 1,
  "suite": "peritext",
  "workload": "multi-epoch-rich",
  "system": "peritext-rga",
  "mode": "none",
  "preset": "bulk",
  "config": {
    "initial": 500,
    "rounds": 6,
    "burst": 300,
    "seed": 1729,
    "pairDrop": true,
    "scenario": "multi-epoch-rich",
    "representation": "rga",
    "matrixVersion": 3
  },
  "environment": {
    "node": "v26.3.1",
    "platform": "darwin arm64",
    "exposeGc": true,
    "date": "2026-08-21T13:46:47.077Z"
  },
  "gates": {
    "converged": true,
    "gcRenderPreserved": true,
    "snapshotOk": true,
    "stateCompactionFiredOrExpectedNoop": true,
    "delayedPruneRefused": true,
    "emptyMetadataFloor": true,
    "multiEpochCompaction": true
  },
  "metrics": {
    "operations": 2307,
    "elapsedMs": 2812.349708,
    "syncMs": 41.710584000000004,
    "syncBytes": 516593,
    "historyGcMs": 0,
    "stateGcMs": 0,
    "intermediateEpochs": 0,
    "intermediatePruned": 0,
    "commitsBeforeFinalGc": 2311,
    "commitsAfter": 2311,
    "commitsWhileAwaitingAck": null,
    "epochPruned": 0,
    "epochPruneReason": null,
    "durableStateBytes": 95380,
    "visibleChars": 931,
    "shadowRecords": 1297,
    "identityRecords": 1297,
    "deletedIds": 367,
    "markRecords": 627,
    "coordinateSymbols": 2291,
    "renderDigest": "e8fee8f06c9506cb80bece8c842213ee92c42d2fa6afd1585ab36840350694de"
  }
}