{
  "schemaVersion": 1,
  "suite": "peritext",
  "workload": "mark-churn",
  "system": "sal-peritext",
  "mode": "text-state",
  "preset": "bulk",
  "config": {
    "initial": 500,
    "rounds": 6,
    "burst": 300,
    "seed": 1729,
    "pairDrop": false,
    "scenario": "mark-churn",
    "representation": "absolute"
  },
  "environment": {
    "node": "v26.3.1",
    "platform": "darwin arm64",
    "exposeGc": true,
    "date": "2026-08-15T09:03:39.534Z"
  },
  "gates": {
    "converged": true,
    "gcRenderPreserved": true,
    "snapshotOk": true,
    "stateCompactionFiredOrExpectedNoop": true,
    "delayedPruneRefused": true,
    "emptyMetadataFloor": true,
    "multiEpochCompaction": true
  },
  "metrics": {
    "operations": 4501,
    "elapsedMs": 42537.816125000005,
    "syncMs": 197.532249,
    "syncBytes": 1259480,
    "historyGcMs": 0,
    "stateGcMs": 13.940666,
    "intermediateEpochs": 0,
    "intermediatePruned": 0,
    "commitsBeforeFinalGc": 4543,
    "commitsAfter": 4543,
    "commitsWhileAwaitingAck": null,
    "epochPruned": 0,
    "epochPruneReason": null,
    "durableStateBytes": 237654,
    "visibleChars": 500,
    "shadowRecords": 500,
    "deletedIds": 1,
    "markRecords": 4000,
    "coordinateSymbols": 125250,
    "renderDigest": "9f82ca421da1741338b72e0a3c3d56a20d8a5c6407c4cf4629abae0486f4163d"
  }
}