{
  "schemaVersion": 1,
  "suite": "peritext",
  "workload": "concurrent-rich",
  "system": "peritext-rga",
  "mode": "history",
  "preset": "freq",
  "config": {
    "initial": 200,
    "rounds": 30,
    "burst": 20,
    "seed": 1729,
    "pairDrop": true,
    "scenario": "concurrent-rich",
    "representation": "rga",
    "matrixVersion": 3
  },
  "environment": {
    "node": "v26.3.1",
    "platform": "darwin arm64",
    "exposeGc": true,
    "date": "2026-08-20T10:56:11.825Z"
  },
  "gates": {
    "converged": true,
    "gcRenderPreserved": true,
    "snapshotOk": true,
    "stateCompactionFiredOrExpectedNoop": true,
    "delayedPruneRefused": true,
    "emptyMetadataFloor": true,
    "multiEpochCompaction": true
  },
  "metrics": {
    "operations": 1401,
    "elapsedMs": 671.1292920000001,
    "syncMs": 37.904455000000006,
    "syncBytes": 319856,
    "historyGcMs": 14.559378,
    "stateGcMs": 0,
    "intermediateEpochs": 0,
    "intermediatePruned": 0,
    "commitsBeforeFinalGc": 43,
    "commitsAfter": 3,
    "commitsWhileAwaitingAck": null,
    "epochPruned": 0,
    "epochPruneReason": null,
    "durableStateBytes": 71084,
    "visibleChars": 311,
    "shadowRecords": 604,
    "identityRecords": 604,
    "deletedIds": 294,
    "markRecords": 498,
    "coordinateSymbols": 1396,
    "renderDigest": "682dc18acbe938ee5a2c27f4911af0e6bd0e7bba097a7142bc66a166dfc1120a"
  }
}