{
  "schemaVersion": 1,
  "suite": "peritext",
  "workload": "format-trace",
  "system": "sal-peritext-shared",
  "mode": "both-delayed",
  "preset": "freq",
  "config": {
    "initial": 200,
    "rounds": 30,
    "burst": 20,
    "seed": 1729,
    "pairDrop": true,
    "scenario": "format-trace",
    "representation": "shared"
  },
  "environment": {
    "node": "v26.3.1",
    "platform": "darwin arm64",
    "exposeGc": true,
    "date": "2026-08-15T08:42:28.683Z"
  },
  "gates": {
    "converged": true,
    "gcRenderPreserved": true,
    "snapshotOk": true,
    "stateCompactionFiredOrExpectedNoop": true,
    "delayedPruneRefused": true,
    "emptyMetadataFloor": true,
    "multiEpochCompaction": true
  },
  "metrics": {
    "operations": 3221,
    "elapsedMs": 744.590625,
    "syncMs": 142.610999,
    "syncBytes": 711445,
    "historyGcMs": 0,
    "stateGcMs": 113.993208,
    "intermediateEpochs": 0,
    "intermediatePruned": 0,
    "commitsBeforeFinalGc": 3222,
    "commitsAfter": 1,
    "commitsWhileAwaitingAck": 3223,
    "epochPruned": 3222,
    "epochPruneReason": null,
    "durableStateBytes": 8989,
    "visibleChars": 2994,
    "shadowRecords": 2994,
    "deletedIds": 0,
    "markRecords": 20,
    "coordinateSymbols": 3008,
    "renderDigest": "1b01cddf9611ad71ba110ddf87aad221814cc6c672eef5fdad8b7c94e6c2121c"
  }
}