{
  "schemaVersion": 1,
  "suite": "peritext",
  "workload": "offline-rich",
  "system": "peritext-embed-rga",
  "mode": "none",
  "preset": "freq",
  "config": {
    "initial": 200,
    "rounds": 30,
    "burst": 20,
    "seed": 1729,
    "pairDrop": true,
    "scenario": "offline-rich",
    "representation": "embed-rga",
    "matrixVersion": 3
  },
  "environment": {
    "node": "v26.3.1",
    "platform": "darwin arm64",
    "exposeGc": true,
    "date": "2026-08-20T10:56:53.413Z"
  },
  "gates": {
    "converged": true,
    "gcRenderPreserved": true,
    "snapshotOk": true,
    "stateCompactionFiredOrExpectedNoop": true,
    "delayedPruneRefused": true,
    "emptyMetadataFloor": true,
    "multiEpochCompaction": true
  },
  "metrics": {
    "operations": 601,
    "elapsedMs": 124.476125,
    "syncMs": 13.218375,
    "syncBytes": 132029,
    "historyGcMs": 0,
    "stateGcMs": 0,
    "intermediateEpochs": 0,
    "intermediatePruned": 0,
    "commitsBeforeFinalGc": 602,
    "commitsAfter": 602,
    "commitsWhileAwaitingAck": null,
    "epochPruned": 0,
    "epochPruneReason": null,
    "durableStateBytes": 9622,
    "visibleChars": 276,
    "shadowRecords": 369,
    "identityRecords": 369,
    "deletedIds": 94,
    "markRecords": 138,
    "coordinateSymbols": 369,
    "renderDigest": "c30459f359d0b9a98f70be15a9ecfb049b86aa76bb99e2b6a6801ffaea845b37"
  }
}