{
  "schemaVersion": 1,
  "suite": "peritext",
  "workload": "format-trace",
  "system": "peritext-sided-embed-rga",
  "mode": "both-delayed",
  "preset": "bulk",
  "config": {
    "initial": 500,
    "rounds": 6,
    "burst": 300,
    "seed": 1729,
    "pairDrop": true,
    "scenario": "format-trace",
    "representation": "sided-embed-rga",
    "matrixVersion": 3
  },
  "environment": {
    "node": "v26.3.1",
    "platform": "darwin arm64",
    "exposeGc": true,
    "date": "2026-08-20T11:11:48.343Z"
  },
  "gates": {
    "converged": true,
    "gcRenderPreserved": true,
    "snapshotOk": true,
    "stateCompactionFiredOrExpectedNoop": true,
    "delayedPruneRefused": true,
    "emptyMetadataFloor": true,
    "multiEpochCompaction": true
  },
  "metrics": {
    "operations": 26752,
    "elapsedMs": 35430.224666999995,
    "syncMs": 375.57937400000003,
    "syncBytes": 6634551,
    "historyGcMs": 0,
    "stateGcMs": 101.861709,
    "intermediateEpochs": 0,
    "intermediatePruned": 0,
    "commitsBeforeFinalGc": 26753,
    "commitsAfter": 1,
    "commitsWhileAwaitingAck": 26754,
    "epochPruned": 26753,
    "epochPruneReason": null,
    "durableStateBytes": 203219,
    "visibleChars": 21862,
    "shadowRecords": 21869,
    "identityRecords": 21869,
    "deletedIds": 7,
    "markRecords": 173,
    "coordinateSymbols": 22773,
    "renderDigest": "0ceed9b076f7780a3a904d0ee1754ad9df7640baaf8ed9984ecda8fcb45d56b7"
  }
}